"DatasetName","DatasetType","ElementNumber","ElementName","V2Number","National","State","Definition","Usage","Comment","V3Changes","MinOccurs","MaxOccurs","IsNillable","DataType","NV","PN","PNNill","NVList","PNList","minLength","maxLength","length","minInclusive","maxInclusive","minExclusive","totalDigits","fractionDigits","pattern",
"EMSDataSet","element","eInjury.12","ACN Incident ID","","","","The Automated Collision Notification Incident ID.","Optional","Based on Vehicular Emergency Data Set:  Incident ID. Vehicular Emergency Data Set (VEDS) Recommendations. Version 3.0 Prepared: (February 2011) by the Advanced Automatic Crash Notification (AACN)Joint APCO/NENA Data Standardization Working Group.","Added to better incorporate advanced automated collision notification information.","0","1","","IncidentID","","","","","","2","100","","","","","","","",
"EMSDataSet","element","eInjury.13","ACN Call Back Phone Number","","","","The Automated Collision Notification Call Back Phone Number (US Only).","Optional","Based on Vehicular Emergency Data Set:  Call Back Number. Vehicular Emergency Data Set (VEDS) Recommendations. Version 3.0 Prepared: (February 2011) by the Advanced Automatic Crash Notification (AACN)Joint APCO/NENA Data Standardization Working Group.","Added to better incorporate advanced automated collision notification information.","0","M","","PhoneNumber","","","","","","","","","","","","","","[2-9][0-9][0-9]-[2-9][0-9][0-9]-[0-9][0-9][0-9][0-9]",
"EMSDataSet","element","eInjury.14","Date/Time of ACN Incident","","","","The Automated Collision Notification Incident Date and Time.","Optional","Based on Vehicular Emergency Data Set:  Incident Date and Time. Vehicular Emergency Data Set (VEDS) Recommendations. Version 3.0 Prepared: (February 2011) by the Advanced Automatic Crash Notification (AACN)Joint APCO/NENA Data Standardization Working Group.  										  	<br/><br/>DateTime consists of finite-length characters of the form: yyyy '-' mm '-' dd 'T' hh ':' mm ':' ss ('.' s+)? (zzzzzz) 									<table  cellspacing="2"><tr><td>							 									<table border="1px" cellpadding="3px" cellspacing="0"> 									  <tr><td align="center">yyyy</td><td>a four-digit numeral that represents the year</td></tr> 									  <tr><td align="center">'-'</td><td>separators between parts of the date portion</td></tr> 									  <tr><td align="center">mm</td><td>a two-digit numeral that represents the month</td></tr> 									  <tr><td align="center">dd</td><td>a two-digit numeral that represents the day</td></tr> 									  <tr><td align="center">T</td><td>separator that indicates time-of-day follows</td></tr> 									  <tr><td align="center">hh</td><td>a two-digit numeral that represents the hour</td></tr> 									  <tr><td align="center">':'</td><td>a separator between parts of the time-of-day portion</td></tr> 									  <tr><td align="center">mm</td><td>a two-digit numeral that represents the minute</td></tr> 									  <tr><td align="center">ss</td><td>a two-integer-digit numeral that represents the whole seconds</td></tr> 									  <tr><td align="center">'.' s+</td><td>(not required) represents the fractional seconds</td></tr> 									  <tr><td align="center">zzzzzz</td><td>(required) represents the timezone (as described below)</td></tr> 									</table>  									</td></tr></table> 									<br/>Timezones, required, are durations with (integer-valued) hour and minute properties in the form: ('+' | '-') hh ':' mm    									<table cellspacing="2"><tr><td>	 									<table border="1px" cellpadding="3px" cellspacing="0"> 									  <tr><td align="center">hh</td><td>a two-digit numeral (with leading zeros as required) that represents the hours</td></tr> 									  <tr><td align="center">mm</td><td>a two-digit numeral that represents the minutes</td></tr> 									  <tr><td align="center">'+'</td><td>a nonnegative duration</td></tr> 									  <tr><td align="center">'-'</td><td>a nonpositive duration</td></tr> 									</table> 									</td></tr></table>","Added to better incorporate advanced automated collision notification information.","0","1","","DateTimeType","","","","","","","","","1950-01-01T00:00:00-00:00","2050-01-01T00:00:00-00:00","","","","[0-9]{4}-[0-9]{2}-[0-9]{2}T[0-9]{2}:[0-9]{2}:[0-9]{2}(\.\d+)?(\+|-)[0-9]{2}:[0-9]{2}",
"EMSDataSet","element","eInjury.15","ACN Incident Location","","","","The Automated Collision Notification GPS Location.","Optional","Based on Vehicular Emergency Data Set:  Location (combining Latitude and Longitude). Vehicular Emergency Data Set (VEDS) Recommendations. Version 3.0 Prepared: (February 2011) by the Advanced Automatic Crash Notification (AACN)Joint APCO/NENA Data Standardization Working Group.										 										  The pattern for GPS location is in the format "<span style="font-style:italic">latitude</span>,<span style="font-style:italic">longitude</span>" where: 										  <br/>- <span style="font-style:italic">latitude</span> has a minimum of -90 and a maximum of 90 with up to 6 decimal places 										  <br/>- <span style="font-style:italic">longitude</span> has a minimum of -180 and a maximum of 180 with up to 6 decimal places","Added to better incorporate advanced automated collision notification information.","0","1","","GPSLocation","","","","","","","","","","","","","","(\+|-)?([9][0]|([1-8][0-9]|[0-9]|90)(\.[0-9]{1,6})?),(\+|-)?([1][8][0]|([1][0-7][0-9]|[1-9][0-9]|[0-9]|90)(\.[0-9]{1,6})?)",
"EMSDataSet","element","eInjury.16","ACN Incident Vehicle Body Type","","","","The Automated Collision Notification Vehicle Body Type.","Optional","Based on Vehicular Emergency Data Set:  Body Type. Vehicular Emergency Data Set (VEDS) Recommendations. Version 3.0 Prepared: (February 2011) by the Advanced Automatic Crash Notification (AACN)Joint APCO/NENA Data Standardization Working Group.","Added to better incorporate advanced automated collision notification information.","0","1","","BodyType","","","","","","2","100","","","","","","","",
"EMSDataSet","element","eInjury.17","ACN Incident Vehicle Manufacturer","","","","The Automated Collision Notification Vehicle Manufacturer (e.g. General Motors, Ford, BMW).","Optional","Based on Vehicular Emergency Data Set:  Manufacturer. Vehicular Emergency Data Set (VEDS) Recommendations. Version 3.0 Prepared: (February 2011) by the Advanced Automatic Crash Notification (AACN)Joint APCO/NENA Data Standardization Working Group.","Added to better incorporate advanced automated collision notification information.","0","1","","Manufacturer","","","","","","2","100","","","","","","","",
"EMSDataSet","element","eInjury.18","ACN Incident Vehicle Make","","","","The Automated Collision Notification Vehicle Make (e.g. Cadillac, Ford, BMW).","Optional","Based on Vehicular Emergency Data Set:  Make. Vehicular Emergency Data Set (VEDS) Recommendations. Version 3.0 Prepared: (February 2011) by the Advanced Automatic Crash Notification (AACN)Joint APCO/NENA Data Standardization Working Group.","Added to better incorporate advanced automated collision notification information.","0","1","","Make","","","","","","2","100","","","","","","","",
"EMSDataSet","element","eInjury.19","ACN Incident Vehicle Model","","","","The Automated Collision Notification Vehicle Model (e.g. Escalade, Taurus, X6M).","Optional","Based on Vehicular Emergency Data Set:  Model. Vehicular Emergency Data Set (VEDS) Recommendations. Version 3.0 Prepared: (February 2011) by the Advanced Automatic Crash Notification (AACN)Joint APCO/NENA Data Standardization Working Group.","Added to better incorporate advanced automated collision notification information.","0","1","","Model","","","","","","1","100","","","","","","","",
"EMSDataSet","element","eInjury.20","ACN Incident Vehicle Model Year","","","","The Automated Collision Notification Vehicle Model Year (e.g. 2010).","Optional","Based on Vehicular Emergency Data Set:  Year. Vehicular Emergency Data Set (VEDS) Recommendations. Version 3.0 Prepared: (February 2011) by the Advanced Automatic Crash Notification (AACN)Joint APCO/NENA Data Standardization Working Group.","Added to better incorporate advanced automated collision notification information.","0","1","","Year","","","","","","","","","1900","2050","","","","",
"EMSDataSet","element","eInjury.21","ACN Incident Multiple Impacts","","","","The Automated Collision Notification Indication of Multiple Impacts associated with the collision.","Optional","Based on Vehicular Emergency Data Set:  Multiple Impacts. Vehicular Emergency Data Set (VEDS) Recommendations. Version 3.0 Prepared: (February 2011) by the Advanced Automatic Crash Notification (AACN)Joint APCO/NENA Data Standardization Working Group.","Added to better incorporate advanced automated collision notification information.","0","1","","YesNoValues","","","","","","","","","","","","","","",
"EMSDataSet","element","eInjury.22","ACN Incident Delta Velocity","","","","The Automated Collision Notification Delta Velocity (Delta V) force associated with the crash.","Optional","Based on Vehicular Emergency Data Set:  Delta Velocity. The force of impact based on the change in velocity over the duration of the crash pulse. Vehicular Emergency Data Set (VEDS) Recommendations. Version 3.0 Prepared: (February 2011) by the Advanced Automatic Crash Notification (AACN)Joint APCO/NENA Data Standardization Working Group.","Added to better incorporate advanced automated collision notification information.","0","M","","DeltaVelocity","","","","","","","","","0","999","","","","",
"EMSDataSet","element","eInjury.23","ACN High Probability of Injury","","","","The Automated Collision Notification of the High Probability of Injury.","Optional","","Added to better incorporate advanced automated collision notification information.","0","1","","YesNoValues","","","","","","","","","","","","","","",
"EMSDataSet","element","eInjury.24","ACN Incident PDOF","","","","The Automated Collision Notification Principal Direction of Force (PDOF).","Optional","Based on Vehicular Emergency Data Set:  PDOF. Principal direction of the force of the impact to nearest o'clock reading.  Values are 1 through 12 (e.g. 12=Frontal collision, 3=passenger side (right) collision, etc). Vehicular Emergency Data Set (VEDS) Recommendations. Version 3.0 Prepared: (February 2011) by the Advanced Automatic Crash Notification (AACN)Joint APCO/NENA Data Standardization Working Group.","Added to better incorporate advanced automated collision notification information.","0","1","","PDOF","","","","","","","","","1","12","","","","",
"EMSDataSet","element","eInjury.25","ACN Incident Rollover","","","","The Automated Collision Notification Indication that the Vehicle Rolled Over.","Optional","Based on Vehicular Emergency Data Set:  Rollover. Indicates if the vehicle rolled over during the collision/event (e.g. True=Rollover, False=No Rollover). Vehicular Emergency Data Set (VEDS) Recommendations. Version 3.0 Prepared: (February 2011) by the Advanced Automatic Crash Notification (AACN)Joint APCO/NENA Data Standardization Working Group.","Added to better incorporate advanced automated collision notification information.","0","1","","ACNYesNoType","","","","","","","","","","","","","","",
"EMSDataSet","element","eInjury.26","ACN Vehicle Seat Location","","","","The Automated Collision Notification Indication of the Occupant(s) Seat Location(s) within the vehicle.","Optional","Based on Vehicular Emergency Data Set:  Seat - Multiple entry for each seats data. Indicates seatbelt and seat sensor data for individual seat position in the vehicle. These elements come from passenger vehicle. Vehicular Emergency Data Set (VEDS) Recommendations. Version 3.0 Prepared: (February 2011) by the Advanced Automatic Crash Notification (AACN)Joint APCO/NENA Data Standardization Working Group.","Added to better incorporate advanced automated collision notification information.","0","1","","SeatLocation","","","","","","","","","","","","","","",
"EMSDataSet","element","eInjury.27","Seat Occupied","","","","Indication if seat is occupied based on seat sensor data.","Optional","Based on Vehicular Emergency Data Set:  Occupied - Associated with each seat. Vehicular Emergency Data Set (VEDS) Recommendations. Version 3.0 Prepared: (February 2011) by the Advanced Automatic Crash Notification (AACN)Joint APCO/NENA Data Standardization Working Group.","Added to better incorporate advanced automated collision notification information.","0","1","","ACNYesNoType","","","","","","","","","","","","","","",
"EMSDataSet","element","eInjury.28","ACN Incident Seatbelt Use","","","","The Automated Collision Notification Indication of Seatbelt use by the occupant(s).","Optional","Based on Vehicular Emergency Data Set:  Belt Fastened - Associated with each Seat. Vehicular Emergency Data Set (VEDS) Recommendations. Version 3.0 Prepared: (February 2011) by the Advanced Automatic Crash Notification (AACN)Joint APCO/NENA Data Standardization Working Group.","Added to better incorporate advanced automated collision notification information.","0","1","","ACNYesNoType","","","","","","","","","","","","","","",
"EMSDataSet","element","eInjury.29","ACN Incident Airbag Deployed","","","","The Automated Collision Notification Indication of Airbag Deployment.","Optional","Based on Vehicular Emergency Data Set:  Deployed - Associated with each seat. Indicates if airbag is deployed. Vehicular Emergency Data Set (VEDS) Recommendations. Version 3.0 Prepared: (February 2011) by the Advanced Automatic Crash Notification (AACN)Joint APCO/NENA Data Standardization Working Group.","Added to better incorporate advanced automated collision notification information.","0","1","","ACNYesNoType","","","","","","","","","","","","","","",
"EMSDataSet","element","eArrest.01","Cardiac Arrest","E11_01","National","State","Indication of the presence of a cardiac arrest at any time.","Required","This element is a component of the Utstein Cardiac Arrest Criteria.","","1","1","Nillable","CardiacArrest","NV","","","NV.NotRecorded; NV.NotApplicable; ","","","","","","","","","","",
"EMSDataSet","element","eArrest.02","Cardiac Arrest Etiology","E11_02","National","State","Indication of the etiology or cause of the cardiac arrest (classified as cardiac, non-cardiac, etc.)","Required","This element is a component of the Utstein Cardiac Arrest Criteria.<br/><br/>Following the UTSTEIN standard of cardiac arrest etiology the values were determined based on the American Heart Association journal "Resuscitation" from 2004 entitled "Cardiac Arrest and Cardiopulmonary Resuscitation Outcome Reports".   http://circ.ahajournals.org/cgi/content/full/110/21/3385","","1","1","Nillable","CardiacArrestEtiology","NV","","","NV.NotRecorded; NV.NotApplicable; ","","","","","","","","","","",
"EMSDataSet","element","eArrest.03","Resuscitation Attempted By EMS","E11_03","National","State","Indication of an attempt to resuscitate the patient who is in cardiac arrest (attempted, not attempted due to DNR, etc.)","Required","This element is a component of the Utstein Cardiac Arrest Criteria as identified in the American Heart Association journal "Resuscitation" from 2004 entitled "Cardiac Arrest and Cardiopulmonary Resuscitation Outcome Reports". http://circ.ahajournals.org/cgi/content/full/110/21/3385","","1","M","Nillable","ResucitationAttempted","NV","","","NV.NotRecorded; NV.NotApplicable; ","","","","","","","","","","",
"EMSDataSet","element","eArrest.04","Arrest Witnessed By","E11_04","National","State","Indication of who the cardiac arrest was witnessed by","Required","This element is a component of the Utstein Cardiac Arrest Criteria as identified in the American Heart Association journal "Resuscitation" from 2004 entitled "Cardiac Arrest and Cardiopulmonary Resuscitation Outcome Reports". http://circ.ahajournals.org/cgi/content/full/110/21/3385","","1","M","Nillable","ArrestWitnessedBy","NV","","","NV.NotRecorded; NV.NotApplicable; ","","","","","","","","","","",
"EMSDataSet","element","eArrest.05","CPR Care Provided Prior to EMS Arrival","","National","State","Documentation of the CPR provided prior to EMS arrival","Required","This element is a component of the Utstein Cardiac Arrest Criteria as identified in the American Heart Association journal "Resuscitation" from 2004 entitled "Cardiac Arrest and Cardiopulmonary Resuscitation Outcome Reports". http://circ.ahajournals.org/cgi/content/full/110/21/3385","","1","1","Nillable","YesNoValues","NV","","","NV.NotRecorded; NV.NotApplicable; ","","","","","","","","","","",
"EMSDataSet","element","eArrest.06","Who Provided CPR Prior to EMS Arrival","","","State","Documentation of who performed CPR prior to this EMS unit's arrival.","Optional","Associated with eArrest.05 (CPR Care Provided Prior to EMS Arrival) but only required if CPR was provided prior to EMS arrival.<br/><br/> This element is a component of the Utstein Cardiac Arrest Criteria as identified in the American Heart Association journal "Resuscitation" from 2004 entitled "Cardiac Arrest and Cardiopulmonary Resuscitation Outcome Reports". http://circ.ahajournals.org/cgi/content/full/110/21/3385","","0","M","","WhoProvided","","","","","","","","","","","","","","",
"EMSDataSet","element","eArrest.07","AED Use Prior to EMS Arrival","","National","State","Documentation of AED use Prior to EMS Arrival","Required","This element is a component of the Utstein Cardiac Arrest Criteria as identified in the American Heart Association journal "Resuscitation" from 2004 entitled "Cardiac Arrest and Cardiopulmonary Resuscitation Outcome Reports". http://circ.ahajournals.org/cgi/content/full/110/21/3385","","1","1","Nillable","AEDUse","NV","","","NV.NotRecorded; NV.NotApplicable; ","","","","","","","","","","",
"EMSDataSet","element","eArrest.08","Who Used AED Prior to EMS Arrival","","","State","Documentation of who used the AED prior to this EMS unit’s arrival.","Optional","Associated with eArrest.07 (AED Use Prior to EMS Arrival). 							<br/><br/>This element is a component of the Utstein Cardiac Arrest Criteria as identified in the American Heart Association journal "Resuscitation" from 2004 entitled "Cardiac Arrest and Cardiopulmonary Resuscitation Outcome Reports". http://circ.ahajournals.org/cgi/content/full/110/21/3385","","0","M","","WhoUsedAED","","","","","","","","","","","","","","",
"EMSDataSet","element","eArrest.09","Type of CPR Provided","","National","State","Documentation of the type/technique of CPR used by EMS.","Required","Added to capture special CPR techniques.","","1","M","Nillable","CPRType","NV","","","NV.NotRecorded; NV.NotApplicable; ","","","","","","","","","","",
"EMSDataSet","element","eArrest.10","Therapeutic Hypothermia Initiated","","National","State","Documentation of EMS initiation of Therapeutic Hypothermia.","Required","","","1","1","Nillable","YesNoValues","NV","","","NV.NotRecorded; NV.NotApplicable; ","","","","","","","","","","",
"EMSDataSet","element","eArrest.11","First Monitored Arrest Rhythm of the Patient","E11_05","National","State","Documentation of what the first monitored arrest rhythm which was noted","Required","Added term "Arrest" to title to clarify this is the arrest rhythm<br/>Values "Other" and "Normal Sinus Rhythm" removed since they are not Cardiac Arrest Rhythms.<br/>Value "Ventricular Tachycardia" has been changed to "Ventricular Tachycardia-Pulseless". 							<br/><br/>This element is a component of the Utstein Cardiac Arrest Criteria as identified in the American Heart Association journal "Resuscitation" from 2004 entitled "Cardiac Arrest and Cardiopulmonary Resuscitation Outcome Reports". http://circ.ahajournals.org/cgi/content/full/110/21/3385","","1","1","Nillable","FirstMonitoredRhythm","NV","","","NV.NotRecorded; NV.NotApplicable; ","","","","","","","","","","",
"EMSDataSet","element","eArrest.12","Any Return of Spontaneous Circulation","E11_06","National","State","Indication whether or not there was any return of spontaneous circulation.","Required","This element is a component of the Utstein Cardiac Arrest Criteria as identified in the American Heart Association journal "Resuscitation" from 2004 entitled "Cardiac Arrest and Cardiopulmonary Resuscitation Outcome Reports". http://circ.ahajournals.org/cgi/content/full/110/21/3385							 <br/><br/>This element needs to be documented when the patient has been in cardiac or respiratory arrest and transported to a healthcare facility to show the change in patient condition, if any. The cardiac rhythm list has been updated to be the same for eVitals.03 (Cardiac Rhythm Electrocardiography (ECG)). They are using the common type: CardiacRhythm. ST segment changes consistent (or not consistent) with STEMI criteria should be documented as Ischemia in the appropriate location","","1","M","Nillable","ReturnOfSpontaneousCirculation","NV","","","NV.NotRecorded; NV.NotApplicable; ","","","","","","","","","","",
"EMSDataSet","element","eArrest.13","Neurological Outcome at Hospital Discharge","E11_07","","","The level of cerebral performance of the patient at the time of discharge from the Hospital","Optional","1 = Good Cerebral Performance:  Conscious, Alert, able to work and lead a normal life.<br/><br/> 							2 = Moderate Cerebral Disability:  Conscious and able to function independently (dress, travel, prepare food) may have hemiplegia, 							seizures, or permanent memory or mental changes.<br/><br/> 							3 = Severe Cerebral Disability:  Conscious, dependent on others for daily support, functions only in an institution or at home with 							exceptional family effort.<br/><br/> 							4 = Coma or vegetative state: any degree of coma without the presence of all brain death criteria. Unawareness, even if appears awake 							(vegetative state) without interaction with environment; may have spontaneous eye opening and sleep/awake cycles. Cerebral 							unresponsiveness. 							<br/><br/> 							This element is a component of the Utstein Cardiac Arrest Criteria as identified in the American Heart Association journal "Resuscitation" from 2004 entitled "Cardiac Arrest and Cardiopulmonary Resuscitation Outcome Reports". http://circ.ahajournals.org/cgi/content/full/110/21/3385","","0","1","","NeurologicalOutcomeAtDischarge","","","","","","","","","","","","","","",
"EMSDataSet","element","eArrest.14","Date/Time of Cardiac Arrest","E11_08","National","State","The date/time of the cardiac arrest (if not known, please estimate).","Required","This element is a component of the Utstein Cardiac Arrest Criteria as identified in the American Heart Association journal "Resuscitation" from 2004 entitled "Cardiac Arrest and Cardiopulmonary Resuscitation Outcome Reports". http://circ.ahajournals.org/cgi/content/full/110/21/3385														 							<br/><br/>Changed from estimated time prior to EMS arrival to date/time of cardiac arrest. 							  	<br/><br/>DateTime consists of finite-length characters of the form: yyyy '-' mm '-' dd 'T' hh ':' mm ':' ss ('.' s+)? (zzzzzz) <table  cellspacing="2"><tr><td>							 <table border="1px" cellpadding="3px" cellspacing="0">   <tr><td align="center">yyyy</td><td>a four-digit numeral that represents the year</td></tr>   <tr><td align="center">'-'</td><td>separators between parts of the date portion</td></tr>   <tr><td align="center">mm</td><td>a two-digit numeral that represents the month</td></tr>   <tr><td align="center">dd</td><td>a two-digit numeral that represents the day</td></tr>   <tr><td align="center">T</td><td>separator that indicates time-of-day follows</td></tr>   <tr><td align="center">hh</td><td>a two-digit numeral that represents the hour</td></tr>   <tr><td align="center">':'</td><td>a separator between parts of the time-of-day portion</td></tr>   <tr><td align="center">mm</td><td>a two-digit numeral that represents the minute</td></tr>   <tr><td align="center">ss</td><td>a two-integer-digit numeral that represents the whole seconds</td></tr>   <tr><td align="center">'.' s+</td><td>(not required) represents the fractional seconds</td></tr>   <tr><td align="center">zzzzzz</td><td>(required) represents the timezone (as described below)</td></tr> </table>  </td></tr></table> <br/>Timezones, required, are durations with (integer-valued) hour and minute properties in the form: ('+' | '-') hh ':' mm    <table cellspacing="2"><tr><td>	 <table border="1px" cellpadding="3px" cellspacing="0">   <tr><td align="center">hh</td><td>a two-digit numeral (with leading zeros as required) that represents the hours</td></tr>   <tr><td align="center">mm</td><td>a two-digit numeral that represents the minutes</td></tr>   <tr><td align="center">'+'</td><td>a nonnegative duration</td></tr>   <tr><td align="center">'-'</td><td>a nonpositive duration</td></tr> </table> </td></tr></table>","","1","1","Nillable","DateTimeType","NV","","","NV.NotRecorded; NV.NotApplicable; ","","","","","1950-01-01T00:00:00-00:00","2050-01-01T00:00:00-00:00","","","","[0-9]{4}-[0-9]{2}-[0-9]{2}T[0-9]{2}:[0-9]{2}:[0-9]{2}(\.\d+)?(\+|-)[0-9]{2}:[0-9]{2}",
