"DatasetName","DatasetType","ElementNumber","ElementName","V2Number","National","State","Definition","Usage","Comment","V3Changes","MinOccurs","MaxOccurs","IsNillable","DataType","NV","PN","PNNill","NVList","PNList","minLength","maxLength","length","minInclusive","maxInclusive","minExclusive","totalDigits","fractionDigits","pattern",
"EMSDataSet","element","eProcedures.01","Date/Time Procedure Performed","E19_01","National","State","The date/time the procedure was performed on the patient","Required","DateTime consists of finite-length characters of the form: yyyy '-' mm '-' dd 'T' hh ':' mm ':' ss ('.' s+)? (zzzzzz) <table  cellspacing="2"><tr><td>							 <table border="1px" cellpadding="3px" cellspacing="0">   <tr><td align="center">yyyy</td><td>a four-digit numeral that represents the year</td></tr>   <tr><td align="center">'-'</td><td>separators between parts of the date portion</td></tr>   <tr><td align="center">mm</td><td>a two-digit numeral that represents the month</td></tr>   <tr><td align="center">dd</td><td>a two-digit numeral that represents the day</td></tr>   <tr><td align="center">T</td><td>separator that indicates time-of-day follows</td></tr>   <tr><td align="center">hh</td><td>a two-digit numeral that represents the hour</td></tr>   <tr><td align="center">':'</td><td>a separator between parts of the time-of-day portion</td></tr>   <tr><td align="center">mm</td><td>a two-digit numeral that represents the minute</td></tr>   <tr><td align="center">ss</td><td>a two-integer-digit numeral that represents the whole seconds</td></tr>   <tr><td align="center">'.' s+</td><td>(not required) represents the fractional seconds</td></tr>   <tr><td align="center">zzzzzz</td><td>(required) represents the timezone (as described below)</td></tr> </table>  </td></tr></table> <br/>Timezones, required, are durations with (integer-valued) hour and minute properties in the form: ('+' | '-') hh ':' mm    <table cellspacing="2"><tr><td>	 <table border="1px" cellpadding="3px" cellspacing="0">   <tr><td align="center">hh</td><td>a two-digit numeral (with leading zeros as required) that represents the hours</td></tr>   <tr><td align="center">mm</td><td>a two-digit numeral that represents the minutes</td></tr>   <tr><td align="center">'+'</td><td>a nonnegative duration</td></tr>   <tr><td align="center">'-'</td><td>a nonpositive duration</td></tr> </table> </td></tr></table>","","1","1","Nillable","DateTimeType","NV","","","NV.NotRecorded; NV.NotApplicable; ","","","","","1950-01-01T00:00:00-00:00","2050-01-01T00:00:00-00:00","","","","[0-9]{4}-[0-9]{2}-[0-9]{2}T[0-9]{2}:[0-9]{2}:[0-9]{2}(\.\d+)?(\+|-)[0-9]{2}:[0-9]{2}",
"EMSDataSet","element","eProcedures.02","Procedure Performed Prior to this Unit's EMS Care","E19_02","National","State","Indicates that the procedure which was performed and documented was performed prior to this EMS units care.","Required","This is the NEMSIS Version 3 method to document prior aid.","","1","1","Nillable","YesNoValues","NV","","","NV.NotRecorded; NV.NotApplicable; ","","","","","","","","","","",
"EMSDataSet","element","eProcedures.03","Procedure","E19_03","National","State","The procedure performed on the patient.","Required","Procedures which are recorded as a Vital Sign do not have to be documented in the Procedure Section. 										<br/>Code list is represented in SNOMEDCT. Reference the NEMSIS Suggested Lists at: http://nemsis.org/v3/resources.html	 										<br/><br/>SNOMEDCT 										<br/>Website: http://www.nlm.nih.gov/research/umls/Snomed/snomed_main.html 										<br/>Product: Product - UMLS Metathesaurus","","1","1","Nillable","snomed","NV","PN","","NV.NotRecorded; NV.NotApplicable; ","PN.UnableToComplete; PN.Refused; PN.DeniedByOrder; PN.ContraindicationNoted; ","","","","100000","1000000000","","","","",
"EMSDataSet","element","eProcedures.04","Size of Procedure Equipment","E19_04","","","The size of the equipment used in the procedure on the patient","Optional","Need business logic to require detail of size appropriate for the procedure.","","0","1","","SizeOfProcedureEquipment","","","","","","1","20","","","","","","","",
"EMSDataSet","element","eProcedures.05","Number of Procedure Attempts","E19_05","National","State","The number of attempts taken to complete a procedure or intervention regardless of success.","Required","","","1","1","Nillable","NumberOfProcedureAttempts","NV","","","NV.NotRecorded; NV.NotApplicable; ","","","","","1","10","","","","",
"EMSDataSet","element","eProcedures.06","Procedure Successful","E19_06","National","State","Indicates that this procedure attempt which was performed on the patient was successful","Required","","","1","1","Nillable","YesNoValues","NV","","","NV.NotRecorded; NV.NotApplicable; ","","","","","","","","","","",
"EMSDataSet","element","eProcedures.07","Procedure Complication","E19_07","National","State","Any complication (abnormal effect on the patient) associated with the performance of the procedure on the patient","Required","","","1","M","Nillable","ProcedureComplication","NV","","","NV.NotRecorded; NV.NotApplicable; ","","","","","","","","","","",
"EMSDataSet","element","eProcedures.08","Response to Procedure","E19_08","National","State","The patient's response to the procedure","Required","","","1","1","Nillable","Response","NV","","","NV.NotRecorded; NV.NotApplicable; ","","","","","","","","","","",
"EMSDataSet","element","eProcedures.09","Procedure Crew Members ID","E19_09","","State","The statewide assigned ID number of the EMS crew member performing the procedure on the patient","Recommended","For an incident that occurs in multiple states, the certification ID number the EMS agency would typically use is based on the EMS agency's state license specific to each EMS professional.  If the incident needs to be reported to each state, then the EMS Agency Number for each state should be submitted as well as the certification ID numbers for each EMS professional on the unit.","","0","1","Nillable","CrewMemberID","NV","","","NV.NotReporting; NV.NotRecorded; NV.NotApplicable; ","","2","15","","","","","","","",
"EMSDataSet","element","eProcedures.10","Role/Type of Person Performing the Procedure","","National","State","The type (level) of EMS or Healthcare Professional performing the procedure. For procedures performed prior to EMS arrival, this may be a non-EMS healthcare professional.","Required","Added to document the type of healthcare professional administering the medication.  This could be auto-completed from the crew ID but is necessary to document medication administration prior to EMS arrival. State may maintain an enumerated list but must collapse to the National Standard. 										<br/><br/>The category EMT-Intermediate includes EMS professionals with an “85” or “99” certification level.","Added to document the type of healthcare professional administering the medication.","1","1","Nillable","EMSCaregiverLevel","NV","","","NV.NotRecorded; NV.NotApplicable; ","","","","","","","","","","",
"EMSDataSet","element","eProcedures.11","Procedure Authorization","E19_10","","","The type of treatment authorization obtained","Optional","","","0","1","","TxAuthorization","","","","","","","","","","","","","","",
"EMSDataSet","element","eProcedures.12","Procedure Authorizing Physician","E19_11","","","The name of the authorizing physician ordering the procedure, if the order was provided by any manner other than protocol (standing order) in eProcedures.11","Optional","","","0","1","","PersonName","","","","","","1","50","","","","","","","",
"EMSDataSet","element","eProcedures.13","Vascular Access Location","E19_12","","State","The location of the vascular access site attempt on the patient, if applicable.","Recommended","This is now associated with the Date/Time of the procedure and therefore changed to single choice. This allows the location to be documented with each procedure and attempt. If the vascular access has been established prior to EMS, this should be documented as such.","","0","1","Nillable","VascularAccessLocation","NV","","","NV.NotReporting; NV.NotRecorded; NV.NotApplicable; ","","","","","","","","","","",
"EMSDataSet","element","eAirway.01","Indications for Invasive Airway","","","State","The clinical indication for performing invasive airway management.","Recommended","","Added to better document airway management.","0","M","Nillable","AirwayIndications","NV","","","NV.NotReporting; NV.NotRecorded; NV.NotApplicable; ","","","","","","","","","","",
"EMSDataSet","element","eAirway.02","Date/Time Airway Device Placement Confirmation","","","State","The date and time the airway device placement was confirmed.","Recommended","SAD=Supraglottic Airway Device 										  	<br/><br/>DateTime consists of finite-length characters of the form: yyyy '-' mm '-' dd 'T' hh ':' mm ':' ss ('.' s+)? (zzzzzz) <table  cellspacing="2"><tr><td>							 <table border="1px" cellpadding="3px" cellspacing="0">   <tr><td align="center">yyyy</td><td>a four-digit numeral that represents the year</td></tr>   <tr><td align="center">'-'</td><td>separators between parts of the date portion</td></tr>   <tr><td align="center">mm</td><td>a two-digit numeral that represents the month</td></tr>   <tr><td align="center">dd</td><td>a two-digit numeral that represents the day</td></tr>   <tr><td align="center">T</td><td>separator that indicates time-of-day follows</td></tr>   <tr><td align="center">hh</td><td>a two-digit numeral that represents the hour</td></tr>   <tr><td align="center">':'</td><td>a separator between parts of the time-of-day portion</td></tr>   <tr><td align="center">mm</td><td>a two-digit numeral that represents the minute</td></tr>   <tr><td align="center">ss</td><td>a two-integer-digit numeral that represents the whole seconds</td></tr>   <tr><td align="center">'.' s+</td><td>(not required) represents the fractional seconds</td></tr>   <tr><td align="center">zzzzzz</td><td>(required) represents the timezone (as described below)</td></tr> </table>  </td></tr></table> <br/>Timezones, required, are durations with (integer-valued) hour and minute properties in the form: ('+' | '-') hh ':' mm    <table cellspacing="2"><tr><td>	 <table border="1px" cellpadding="3px" cellspacing="0">   <tr><td align="center">hh</td><td>a two-digit numeral (with leading zeros as required) that represents the hours</td></tr>   <tr><td align="center">mm</td><td>a two-digit numeral that represents the minutes</td></tr>   <tr><td align="center">'+'</td><td>a nonnegative duration</td></tr>   <tr><td align="center">'-'</td><td>a nonpositive duration</td></tr> </table> </td></tr></table>","Added to better document airway management.","0","1","Nillable","DateTimeType","NV","","","NV.NotReporting; NV.NotRecorded; NV.NotApplicable; ","","","","","1950-01-01T00:00:00-00:00","2050-01-01T00:00:00-00:00","","","","[0-9]{4}-[0-9]{2}-[0-9]{2}T[0-9]{2}:[0-9]{2}:[0-9]{2}(\.\d+)?(\+|-)[0-9]{2}:[0-9]{2}",
"EMSDataSet","element","eAirway.03","Airway Device Being Confirmed","","","State","The airway device in which placement is being confirmed.","Recommended","","Added to better document airway management. SAD means Supraglottic Airway  Device.","0","1","Nillable","DeviceBeingConfirmed","NV","","","NV.NotReporting; NV.NotRecorded; NV.NotApplicable; ","","","","","","","","","","",
"EMSDataSet","element","eAirway.04","Airway Device Placement Confirmed Method","","","State","The method used to confirm the airway device placement.","Recommended","If the invasive airway is confirmed via multiple methods each method should be documented individually by time, method, and type of individual.","Added to better document airway management.","0","1","Nillable","DeviceConfirmedMethods","NV","","","NV.NotReporting; NV.NotRecorded; NV.NotApplicable; ","","","","","","","","","","",
"EMSDataSet","element","eAirway.05","Tube Depth","","","","The measurement at the patient's teeth/lip of the tube depth in centimeters (cm) of the invasive airway placed.","Optional","Tube Depth added to better document the initial placement of the airway device and subsequent assessments.","","0","1","","TubeDepth","","","","","","","","","8","32","","","","",
"EMSDataSet","element","eAirway.06","Type of Individual Confirming Airway Device Placement","","","State","The type of individual who confirmed the airway device placement.","Recommended","","Added to better document airway management.","0","1","Nillable","IndividualDetails","NV","","","NV.NotReporting; NV.NotRecorded; NV.NotApplicable; ","","","","","","","","","","",
"EMSDataSet","element","eAirway.07","Crew Member ID","","","State","The crew member id during this EMS patient encounter at this date and time.","Recommended","","Added to better document airway management.","0","1","Nillable","CrewMemberID","NV","","","NV.NotReporting; NV.NotRecorded; NV.NotApplicable; ","","2","15","","","","","","","",
"EMSDataSet","element","eAirway.08","Airway Complications Encountered","","","State","The airway management complications encountered during the patient care episode.","Recommended","","Added to better document airway management.","0","M","Nillable","ComplicationsEncountered","NV","","","NV.NotReporting; NV.NotRecorded; NV.NotApplicable; ","","","","","","","","","","",
"EMSDataSet","element","eAirway.09","Suspected Reasons for Failed Airway Procedure","","","State","The reason(s) the airway was unable to be successfully managed.","Optional","","Added to better document airway management.","0","M","","ReasonsForFailure","","","","","","","","","","","","","","",
"EMSDataSet","element","eAirway.10","Date/Time Decision to Manage the Patient with an Invasive Airway","","","","The date and time the decision was made to manage the patient's airway with an invasive airway device.","Optional","DateTime consists of finite-length characters of the form: yyyy '-' mm '-' dd 'T' hh ':' mm ':' ss ('.' s+)? (zzzzzz) <table  cellspacing="2"><tr><td>							 <table border="1px" cellpadding="3px" cellspacing="0">   <tr><td align="center">yyyy</td><td>a four-digit numeral that represents the year</td></tr>   <tr><td align="center">'-'</td><td>separators between parts of the date portion</td></tr>   <tr><td align="center">mm</td><td>a two-digit numeral that represents the month</td></tr>   <tr><td align="center">dd</td><td>a two-digit numeral that represents the day</td></tr>   <tr><td align="center">T</td><td>separator that indicates time-of-day follows</td></tr>   <tr><td align="center">hh</td><td>a two-digit numeral that represents the hour</td></tr>   <tr><td align="center">':'</td><td>a separator between parts of the time-of-day portion</td></tr>   <tr><td align="center">mm</td><td>a two-digit numeral that represents the minute</td></tr>   <tr><td align="center">ss</td><td>a two-integer-digit numeral that represents the whole seconds</td></tr>   <tr><td align="center">'.' s+</td><td>(not required) represents the fractional seconds</td></tr>   <tr><td align="center">zzzzzz</td><td>(required) represents the timezone (as described below)</td></tr> </table>  </td></tr></table> <br/>Timezones, required, are durations with (integer-valued) hour and minute properties in the form: ('+' | '-') hh ':' mm    <table cellspacing="2"><tr><td>	 <table border="1px" cellpadding="3px" cellspacing="0">   <tr><td align="center">hh</td><td>a two-digit numeral (with leading zeros as required) that represents the hours</td></tr>   <tr><td align="center">mm</td><td>a two-digit numeral that represents the minutes</td></tr>   <tr><td align="center">'+'</td><td>a nonnegative duration</td></tr>   <tr><td align="center">'-'</td><td>a nonpositive duration</td></tr> </table> </td></tr></table>","Added to better document airway management.","0","1","","DateTimeType","","","","","","","","","1950-01-01T00:00:00-00:00","2050-01-01T00:00:00-00:00","","","","[0-9]{4}-[0-9]{2}-[0-9]{2}T[0-9]{2}:[0-9]{2}:[0-9]{2}(\.\d+)?(\+|-)[0-9]{2}:[0-9]{2}",
"EMSDataSet","element","eAirway.11","Date/Time Invasive Airway Placement Attempts Abandoned","","","","The date and time that the invasive airway attempts were abandoned for the patient.","Optional","DateTime consists of finite-length characters of the form: yyyy '-' mm '-' dd 'T' hh ':' mm ':' ss ('.' s+)? (zzzzzz) <table  cellspacing="2"><tr><td>							 <table border="1px" cellpadding="3px" cellspacing="0">   <tr><td align="center">yyyy</td><td>a four-digit numeral that represents the year</td></tr>   <tr><td align="center">'-'</td><td>separators between parts of the date portion</td></tr>   <tr><td align="center">mm</td><td>a two-digit numeral that represents the month</td></tr>   <tr><td align="center">dd</td><td>a two-digit numeral that represents the day</td></tr>   <tr><td align="center">T</td><td>separator that indicates time-of-day follows</td></tr>   <tr><td align="center">hh</td><td>a two-digit numeral that represents the hour</td></tr>   <tr><td align="center">':'</td><td>a separator between parts of the time-of-day portion</td></tr>   <tr><td align="center">mm</td><td>a two-digit numeral that represents the minute</td></tr>   <tr><td align="center">ss</td><td>a two-integer-digit numeral that represents the whole seconds</td></tr>   <tr><td align="center">'.' s+</td><td>(not required) represents the fractional seconds</td></tr>   <tr><td align="center">zzzzzz</td><td>(required) represents the timezone (as described below)</td></tr> </table>  </td></tr></table> <br/>Timezones, required, are durations with (integer-valued) hour and minute properties in the form: ('+' | '-') hh ':' mm    <table cellspacing="2"><tr><td>	 <table border="1px" cellpadding="3px" cellspacing="0">   <tr><td align="center">hh</td><td>a two-digit numeral (with leading zeros as required) that represents the hours</td></tr>   <tr><td align="center">mm</td><td>a two-digit numeral that represents the minutes</td></tr>   <tr><td align="center">'+'</td><td>a nonnegative duration</td></tr>   <tr><td align="center">'-'</td><td>a nonpositive duration</td></tr> </table> </td></tr></table>","Added to better document airway management.","0","1","","DateTimeType","","","","","","","","","1950-01-01T00:00:00-00:00","2050-01-01T00:00:00-00:00","","","","[0-9]{4}-[0-9]{2}-[0-9]{2}T[0-9]{2}:[0-9]{2}:[0-9]{2}(\.\d+)?(\+|-)[0-9]{2}:[0-9]{2}",
"EMSDataSet","element","eDevice.01","Medical Device Serial Number","","","","The unique manufacturer's serial number associated with a medical device.","Optional","","","0","1","","DeviceSerialNumber","","","","","","2","50","","","","","","","",
"EMSDataSet","element","eDevice.02","Date/Time of Event (per Medical Device)","E21_01","","","The time of the event recorded by the device's internal clock","Optional","DateTime consists of finite-length characters of the form: yyyy '-' mm '-' dd 'T' hh ':' mm ':' ss ('.' s+)? (zzzzzz) <table  cellspacing="2"><tr><td>							 <table border="1px" cellpadding="3px" cellspacing="0">   <tr><td align="center">yyyy</td><td>a four-digit numeral that represents the year</td></tr>   <tr><td align="center">'-'</td><td>separators between parts of the date portion</td></tr>   <tr><td align="center">mm</td><td>a two-digit numeral that represents the month</td></tr>   <tr><td align="center">dd</td><td>a two-digit numeral that represents the day</td></tr>   <tr><td align="center">T</td><td>separator that indicates time-of-day follows</td></tr>   <tr><td align="center">hh</td><td>a two-digit numeral that represents the hour</td></tr>   <tr><td align="center">':'</td><td>a separator between parts of the time-of-day portion</td></tr>   <tr><td align="center">mm</td><td>a two-digit numeral that represents the minute</td></tr>   <tr><td align="center">ss</td><td>a two-integer-digit numeral that represents the whole seconds</td></tr>   <tr><td align="center">'.' s+</td><td>(not required) represents the fractional seconds</td></tr>   <tr><td align="center">zzzzzz</td><td>(required) represents the timezone (as described below)</td></tr> </table>  </td></tr></table> <br/>Timezones, required, are durations with (integer-valued) hour and minute properties in the form: ('+' | '-') hh ':' mm    <table cellspacing="2"><tr><td>	 <table border="1px" cellpadding="3px" cellspacing="0">   <tr><td align="center">hh</td><td>a two-digit numeral (with leading zeros as required) that represents the hours</td></tr>   <tr><td align="center">mm</td><td>a two-digit numeral that represents the minutes</td></tr>   <tr><td align="center">'+'</td><td>a nonnegative duration</td></tr>   <tr><td align="center">'-'</td><td>a nonpositive duration</td></tr> </table> </td></tr></table>","","0","1","","DateTimeType","","","","","","","","","1950-01-01T00:00:00-00:00","2050-01-01T00:00:00-00:00","","","","[0-9]{4}-[0-9]{2}-[0-9]{2}T[0-9]{2}:[0-9]{2}:[0-9]{2}(\.\d+)?(\+|-)[0-9]{2}:[0-9]{2}",
"EMSDataSet","element","eDevice.03","Medical Device Event Type","E21_02","","","The type of event documented by the medical device.","Optional","Can be displayed in the Vital Signs or Procedure Sections.","","0","M","","MedicalDeviceEventType","","","","","","","","","","","","","","",
"EMSDataSet","element","eDevice.04","Medical Device Waveform Graphic Type","E21_03","","","The description of the waveform file stored in Waveform Graphic (eDevice.05).","Optional","The description is defined as the extension of the file type.   																	Examples of file name extensions include “doc”, “jpeg”, “tiff”, etc.  For a list of additional extensions reference the following website(s): <br/> <table><tr><td width="10px"></td><td> <table> <tr><td>3D Image formats: <span style="color:blue">http://www.fileinfo.com/filetypes/3d_image</span></td></tr>  <tr><td>Raster Image formats: <span style="color:blue">http://www.fileinfo.com/filetypes/raster_image</span></td></tr>  <tr><td>Vector Image formats: <span style="color:blue">http://www.fileinfo.com/filetypes/vector_image</span></td></tr>  <tr><td><br/></td></tr> <tr><td>Video formats: <span style="color:blue">http://www.fileinfo.com/filetypes/video</span></td></tr>  <tr><td>Audio formats: <span style="color:blue">http://www.fileinfo.com/filetypes/audio</span></td></tr>  <tr><td><br/></td></tr> <tr><td>Comparison of formats:</td></tr>  <tr><td>Image: <span style="color:blue">http://en.wikipedia.org/wiki/Comparison_of_image_file_formats</span></td></tr>  <tr><td>Audio: <span style="color:blue">http://en.wikipedia.org/wiki/Audio_file_format</span></td></tr>  <tr><td>Container: <span style="color:blue">http://en.wikipedia.org/wiki/Comparison_of_container_formats</span></td></tr>  <tr><td><br/></td></tr> <tr><td>A general list of image formats: <span style="color:blue">http://en.wikipedia.org/wiki/Image_file_formats</span></td></tr>  <tr><td>Mime Types: <span style="color:blue">http://en.wikipedia.org/wiki/Internet_media_type</span></td></tr> </table> </td></tr></table>","","0","1","","GraphicType","","","","","","1","255","","","","","","","",
"EMSDataSet","element","eDevice.05","Medical Device Waveform Graphic","E21_04","","","The graphic waveform file.","Optional","","","0","1","","WaveformGraphic","","","","","","","","","","","","","","",
"EMSDataSet","element","eDevice.06","Medical Device Mode (Manual, AED, Pacing, CO2, O2, etc)","E21_05","","","The mode of operation the device is operating in during the defibrillation, pacing, or rhythm analysis by the device (if appropriate for the event)","Optional","","","0","1","","AEDPacingOrCO2Mode","","","","","","","","","","","","","","",
"EMSDataSet","element","eDevice.07","Medical Device ECG Lead","E21_06","","","The lead or source which the medical device used to obtain the rhythm (if appropriate for the event)","Optional","Can be displayed in the Vital Signs or Procedure Sections.","","0","M","","ECGLead","","","","","","","","","","","","","","",
"EMSDataSet","element","eDevice.08","Medical Device ECG Interpretation","E21_07","","","The interpretation of the rhythm by the device (if appropriate for the event)","Optional","The rhythm interpretation text imported from the device.","","0","1","","ECGInterpretation","","","","","","1","2000","","","","","","","",
"EMSDataSet","element","eDevice.09","Type of Shock","E21_08","","","The type of shock used by the device for the defibrillation (if appropriate for the event)","Optional","","","0","1","","TypeOfShock","","","","","","","","","","","","","","",
"EMSDataSet","element","eDevice.10","Shock or Pacing Energy","E21_09","","","The energy (in joules) used for the shock or pacing (if appropriate for the event)","Optional","","","0","1","","ShockOrPacingEnergy","","","","","","","","","1","9000","","5","1","",
"EMSDataSet","element","eDevice.11","Total Number of Shocks Delivered","E21_10","","","The number of times the patient was defibrillated, if the patient was defibrillated during the patient encounter.","Optional","","","0","1","","TotalNumberOfShocks","","","","","","","","","1","100","","","","",
"EMSDataSet","element","eDevice.12","Pacing Rate","E21_11","","","The rate the device was calibrated to pace during the event, if appropriate.","Optional","","","0","1","","PacingRate","","","","","","","","","1","1000","","","","",
"EMSDataSet","element","eDisposition.01","Destination/Transferred To, Name","E20_01","","State","The destination the patient was delivered or transferred to.","Recommended","Recommended State data element since no national code for destination. May be populated from the list in dFacility.02 (Facility Name).","","0","1","Nillable","DestinationTransferredToName","NV","","","NV.NotReporting; NV.NotRecorded; NV.NotApplicable; ","","2","100","","","","","","","",
